movieId,title,genres,tags
3949,Requiem for a Dream (2000),Drama,addiction bleak brutal brutality cerebral cinematography complex dark depressing disturbing drama dramatic dreams drug abuse drug addiction drugs emotional good soundtrack great acting great ending hard to watch harsh heartbreaking heroin imdb top 250 independent film insanity intense interesting loneliness masterpiece melancholic mother-son relationship obsession original oscar (best actress) oscar (best directing) powerful ending psychological psychology realistic relationships sad social commentary storytelling thought-provoking tragedy visceral visually appealing visually stunning weird
3994,Unbreakable (2000),Drama|Sci-Fi,based on a comic comic book comics great ending original plot twist storytelling super hero super-hero superhero superheroes supernatural surprise ending suspense twist twist ending
4016,"Emperor's New Groove, The (2000)",Adventure|Animation|Children|Comedy|Fantasy,animated animation cartoon computer animation disney disney animated feature friendship talking animals
4019,Finding Forrester (2000),Drama,feel good movie feel-good friendship good great acting high school inspirational inspiring literature mentor school unlikely friendships writer's life writers writing
4022,Cast Away (2000),Drama,destiny drama good great acting great ending intense island isolation loneliness original solitude story stranded survival
4023,"Family Man, The (2000)",Comedy|Drama|Romance,destiny feel-good life mentor new jersey romantic comedy
4103,Empire of the Sun (1987),Action|Adventure|Drama|War,based on a book best war films camp cinematography drama dramatic innocence lost mentor oscar (best cinematography) storytelling visually stunning war wartime world war ii wwii
4144,In the Mood For Love (Fa yeung nin wa) (2000),Drama|Romance,adultery art house beautiful beautifully filmed bittersweet cerebral cinematography criterion enigmatic foreign golden palm great cinematography heartbreaking hong kong intimate loneliness love love story masterpiece meditative melancholic melancholy nocturnal relationships romantic stylized visual visually appealing visually stunning
4299,"Knight's Tale, A (2001)",Action|Comedy|Romance,entertaining fun movie happy ending medieval period piece
4306,Shrek (2001),Adventure|Animation|Children|Comedy|Fantasy|Romance,adventure animated animation based on book cartoon children clever comedy computer animation crude humor disney fairy tale fairy tales family fantasy fantasy world fun fun movie funny good great great movie hilarious humor humorous imdb top 250 kids original oscar (best animated feature) oscar winner storytelling talking animals very funny witty
4308,Moulin Rouge (2001),Drama|Musical|Romance,cinematography colourful dancing good music love love story lyrical music musical original passionate stylized visually appealing visually stunning
4325,"Night, The (Notte, La) (1960)",Drama,adultery black and white bleak criterion enigmatic existentialism golden palm infidelity intimate loneliness marriage meditative melancholic melancholy reflective relationships talky
4422,Cries and Whispers (Viskningar och rop) (1972),Drama,adultery affectionate bleak breathtaking cancer cerebral cinematography coen bros criterion death depressing depression disturbing downbeat dreamlike enigmatic existentialism family bonds golden palm intimate life & death loneliness lyrical masterpiece meditative melancholic melancholy oscar (best cinematography) oscar (best foreign language film) poignant relationships sisters solitude stylized swedish talky tense terminal illness visceral visually appealing
4535,"Man from Snowy River, The (1982)",Drama|Romance|Western,amazing cinematography australia australian beautiful scenery gunfight horses love story romance runaway scenic wilderness
4571,Bill & Ted's Excellent Adventure (1989),Adventure|Comedy|Sci-Fi,1980s 80s adventure comedy cult classic dumb but funny excellent fun movie future goofy high school historical history original quotable scifi silly fun teen teen movie time travel us history
4703,Chocolat (1988),Drama,africa colonialism france french reflective relationships storytelling
4720,"Others, The (2001)",Drama|Horror|Mystery|Thriller,afterlife atmospheric cinematography creepy dark drama eerie frightening ghosts great acting great ending haunted house horror mystery ominous original oscar (best directing) plot twist psychological psychology scary storytelling supernatural surprise ending suspense suspenseful thriller twist twist ending twists & turns
4857,Fiddler on the Roof (1971),Drama|Musical,broadway good music jewish jews judaism music musical oscar (best cinematography)
4874,K-PAX (2001),Drama|Fantasy|Mystery|Sci-Fi,alien aliens cerebral doctors first contact great acting philosophical psychiatrist sci-fi science fiction space
4886,"Monsters, Inc. (2001)",Adventure|Animation|Children|Comedy|Fantasy,animated animation cartoon childhood children clever computer animation cute cute! disney family friendship fun funny good great great movie heartwarming imagination imdb top 250 kids kids and family monster monsters original oscar (best animated feature) oscar winner pixar pixar animation story sweet touching toys
4896,Harry Potter and the Sorcerer's Stone (a.k.a. Harry Potter and the Philosopher's Stone) (2001),Adventure|Children|Fantasy,adapted from:book adventure based on a book based on book big budget boarding school book book was better books childhood children coming of age destiny emma watson family fantasy fantasy world franchise good versus evil harry potter high fantasy imagination kids kids and family magic modern fantasy mythology parallel universe school series special effects witch witches wizards
4963,Ocean's Eleven (2001),Crime|Thriller,action caper casino clever con artists con men cool crime ensemble cast entertaining fast paced fun fun movie good great movie heist las vegas original pg-13 plot twist remake robbery suspense twists & turns
4973,"Amelie (Fabuleux destin d'Amélie Poulain, Le) (2001)",Comedy|Romance,affectionate beautiful beautiful scenery beautifully filmed childhood cinematography colourful destiny excellent script fairy tale feel good movie feel-good foreign france french good soundtrack great cinematography great soundtrack heartwarming idealism imagination imdb top 250 life light loneliness love love story magic realism masterpiece melancholic narrated original paris quirky romantic storytelling stylized surreal sweet touching visual visually appealing visually stunning weird whimsical
4993,"Lord of the Rings: The Fellowship of the Ring, The (2001)",Adventure|Fantasy,action adapted from:book adventure awesome soundtrack based on a book based on book beautifully filmed big budget book book was better books cgi cool cult dialogue dynamic cgi action epic exciting fantasy fantasy world fighting franchise friendship good good versus evil great great ending great movie high fantasy imagination imdb top 250 inspiring literary adaptation liv tyler long magic masterpiece modern fantasy mythology original original plot oscar oscar (best cinematography) oscar (best directing) oscar (best effects - visual effects) saturn award (best special effects) scenic shallow special effects story storytelling sword fight tolkien trilogy visual visually appealing visually stunning wizards
4995,"Beautiful Mind, A (2001)",Drama|Romance,based on a true story based on true story biographical biography biopic drama dramatic excellent script exceptional acting genius good good acting great acting great ending imdb top 250 insanity inspirational intellectual interesting life math mathematics mental illness mentor original oscar oscar (best actor) oscar (best actress) oscar (best directing) oscar (best picture) oscar (best supporting actress) oscar winner paranoia plot twist powerful ending psychiatry schizophrenia storytelling true story
5010,Black Hawk Down (2001),Action|Drama|War,action action packed based on a book based on a true story based on true story best war films brutality civil war courage dramatic factual forceful genocide intense military oscar (best directing) oscar (best editing) realistic realistic action true story violence violent visceral war war movie weapons
5103,"Sandlot, The (1993)",Children|Comedy|Drama,baseball childhood children coming of age friendship fun movie kids kids and family mentor nostalgic sports unlikely friendships
5147,Wild Strawberries (Smultronstället) (1957),Drama,aging allegory black and white bleak breathtaking cerebral childhood cinematography compassionate criterion drama dreams enigmatic existentialism golden palm imdb top 250 intimate life life & death loneliness lyrical masterpiece meditative melancholic melancholy poignant reflective relationships road trip runaway swedish talky wistful
5269,"Piano Teacher, The (La pianiste) (2001)",Drama,art house bdsm bleak classical music controversial criterion disturbing erotic insanity intimate loneliness obsession pornography psychological psychology relationships sex sexual sexuality sexualized violence visceral voyeurism weird
5349,Spider-Man (2002),Action|Adventure|Sci-Fi|Thriller,action action packed adapted from:comic adventure alter ego based on a comic based on comic big budget cgi comic book comic book adaption comics cool dark hero dynamic cgi action fight scenes franchise good good action great great movie marvel mutants original pg-13 sequel special effects story super hero super-hero superhero superheroes vigilante
5418,"Bourne Identity, The (2002)",Action|Mystery|Thriller,action action packed adapted from:book amnesia assassin assassination assassins based on a book based on book car chase chase cia conspiracy cool entertaining espionage excellent exciting fast paced fight scenes good action hit men memory loss mentor paris pg-13 realistic action robert ludlum secret service secrets spies spy spying surveillance suspense thriller tom clancy
5445,Minority Report (2002),Action|Crime|Mystery|Sci-Fi|Thriller,action artificial intelligence big budget cerebral chase complex corruption crime destiny dystopia dystopic future future futuristic great ending interesting murder original oscar (best editing) pg-13 philip k. dick plot holes plot twist sci fi sci-fi science fiction scifi special effects spielberg storytelling surveillance suspense technology thought-provoking time loop twists & turns visual visually appealing visually stunning
5574,"Transporter, The (2002)",Action|Crime,action action packed car chase cars chase cool fast paced fight scenes good action lone hero martial arts
5684,Naqoyqatsi (2002),Documentary,criterion humanity meditative reflective stunning technology trilogy visual visually appealing
5767,Teddy Bear (Mis) (1981),Comedy|Crime,censorship comedy communism criterion foreign greed melancholic poland satire storytelling very funny
5816,Harry Potter and the Chamber of Secrets (2002),Adventure|Fantasy,action adapted from:book adventure based on a book based on book big budget boarding school book book was better books childhood children coming of age emma watson family fantasy fantasy world franchise good versus evil harry potter high fantasy imagination kids magic mythology parallel universe pg-13 school secrets sequel series special effects witch witches wizards
5878,Talk to Her (Hable con Ella) (2002),Drama|Romance,almodovar drama enigmatic foreign friendship imdb top 250 intimate loneliness love melancholic obsession relationships spain spanish unlikely friendships visually appealing women
5912,Hit the Bank (Vabank) (1981),Comedy|Crime,bank robbery con artists poland
5952,"Lord of the Rings: The Two Towers, The (2002)",Adventure|Fantasy,action adapted from:book adventure awesome soundtrack based on a book based on book beautifully filmed big budget book was better books cgi cool cult dialogue dynamic cgi action epic exciting fantasy fantasy world fighting franchise friendship good good versus evil great great ending great movie high fantasy imagination imdb top 250 inspiring liv tyler long magic modern fantasy mythology original original plot oscar oscar (best directing) oscar (best effects - visual effects) oscar (best sound) saturn award (best special effects) scenic shallow special effects story storytelling sword fight tolkien trilogy violent visual visually appealing visually stunning war wizards
5955,Antwone Fisher (2002),Drama,biopic mentor psychiatrist
6016,City of God (Cidade de Deus) (2002),Action|Adventure|Crime|Drama|Thriller,amazing cinematography amazing photography based on a true story bleak brazil brutal brutality childhood cinematography coming of age corruption crime dark drama dramatic drug abuse drugs forceful foreign gangs gangster gangsters good soundtrack gratuitous violence great acting great ending grim gritty harsh imdb top 250 innocence lost intense interesting latin america masterpiece mob narrated organized crime original oscar (best cinematography) oscar (best directing) oscar (best editing) photography poverty powerful ending realistic rio de janeiro social commentary storytelling stylish stylized tense tragedy true story vengeance violence violent visceral visually appealing visually stunning
6156,Shanghai Knights (2003),Action|Adventure|Comedy,action action packed buddy movie comedy fight scenes funny good sequel kung fu martial arts sequels silly fun
6157,Daredevil (2003),Action|Crime,action adapted from:comic alter ego bad cgi based on a comic based on comic big budget comic book comics dark hero dynamic cgi action fight scenes franchise good action graphic novel heroine in tight suit marvel mutants pg-13 special effects stupid as hell super hero super-hero superhero superheroes vigilante
6213,Tears of the Sun (2003),Action|Drama|Thriller,action africa best war films brutality civil war genocide good action jungle military realistic action war
6287,Anger Management (2003),Comedy,buddy movie comedy funny hilarious pg-13 very funny
6311,"Other Side of Heaven, The (2001)",Adventure|Drama,adventure based on a book based on a true story based on true story big budget love story pg-13 true story
6333,X2: X-Men United (2003),Action|Adventure|Sci-Fi|Thriller,action action packed adapted from:comic alter ego based on a comic based on comic big budget comic book comic book adaption comics cool dynamic cgi action fight scenes fighting franchise genetics good good action good sequel great great movie marvel mutants pg-13 sequel sequels special effects super hero super-hero superhero superheroes teleportation vigilante
6370,"Spanish Apartment, The (L'auberge espagnole) (2002)",Comedy|Drama|Romance,foreign france friendship paris spain spanish
6377,Finding Nemo (2003),Adventure|Animation|Children|Comedy,adventure animals animated animation cartoon childhood children comedy computer animation cute cute! disney entertaining family feel good movie fish friendship fun funny good great great movie heartwarming imdb top 250 kids kids and family memory loss original oscar (best animated feature) oscar winner pixar pixar animation short-term memory loss single father story storytelling talking animals touching toys visually stunning
6539,Pirates of the Caribbean: The Curse of the Black Pearl (2003),Action|Adventure|Comedy|Fantasy,action action packed adventure anti-hero awesome soundtrack big budget comedy entertaining fantasy world fight scenes fun fun movie good great great movie humorous imdb top 250 love story original pg-13 pirates romance special effects story swashbuckler sword fight sword fighting treasure treasure hunt
6565,Seabiscuit (2003),Drama,1930s based on a true story based on book based on true story courage drama dramatic feel good movie feel-good great great movie horses inspirational inspiring mentor pg-13 racing rags to riches sentimental sports true story underdog
6711,Lost in Translation (2003),Comedy|Drama|Romance,amazing cinematography bittersweet cinematography culture clash dialogue foreign francis ford copolla good soundtrack intimate japan loneliness melancholic melancholy midlife crisis nocturnal original poignant reflective relationships slow paced sophia coppola storytelling stylized tokyo unlikely friendships visually appealing weird
6753,Secondhand Lions (2003),Children|Comedy|Drama,coming of age feel-good great great movie lions mentor oscar (best supporting actor) story storytelling
6879,Runaway Jury (2003),Drama|Thriller,adapted from:book based on a book corruption courtroom courtroom drama guns justice lawyer lawyers manipulation pg-13 surveillance suspense
6947,Master and Commander: The Far Side of the World (2003),Adventure|Drama|War,18th century action adapted from:book based on a book based on book historical oscar (best cinematography) period piece war
6954,"Barbarian Invasions, The (Les invasions barbares) (2003)",Comedy|Crime|Drama|Mystery|Romance,cancer death existentialism father son relationship foreign hospital intellectual life life & death melancholic oscar (best foreign language film) poignant reflective relationships sad terminal illness touching tragedy
7004,Kindergarten Cop (1990),Action|Comedy|Crime|Thriller,action arnold chase children comedy kids teacher undercover cop
7007,"Last Boy Scout, The (1991)",Action|Comedy|Crime|Drama|Thriller,action action packed assassin buddy movie chase corruption fast paced good action gunfight los angeles private detective realistic action secret service vengeance violence
7075,"Court Jester, The (1956)",Adventure|Comedy|Musical,affectionate classic clever comedy england fairy tale hilarious medieval spoof swashbuckler sword fight sword fighting
7090,Hero (Ying xiong) (2002),Action|Adventure|Drama,action amazing cinematography amazing photography assassin assassination beautiful beautiful scenery beautifully filmed breathtaking china cinematography colourful epic fight scenes foreign great cinematography imdb top 250 kung fu martial arts masterpiece original oscar (best directing) oscar (best foreign language film) photography scenic story storytelling stunning stylized sword fight sword fighting visual visually appealing visually stunning wuxia
7143,"Last Samurai, The (2003)",Action|Adventure|Drama|War,action amazing photography beautiful scenery cinematography civil war destiny dramatic epic fight scenes good great acting historical history intense japan japanese mentor oscar (best supporting actor) rebellion samurai sword fight sword fighting war
7153,"Lord of the Rings: The Return of the King, The (2003)",Action|Adventure|Drama|Fantasy,action adapted from:book adventure awesome soundtrack based on a book based on book beautifully filmed big budget book was better cgi cool dialogue dynamic cgi action epic exciting fantasy fantasy world fighting franchise friendship good good versus evil great great acting great ending great movie high fantasy imagination imdb top 250 inspiring liv tyler long magic masterpiece modern fantasy mythology original original plot oscar oscar (best cinematography) oscar (best directing) oscar (best effects - visual effects) oscar (best picture) saturn award (best special effects) scenic special effects story storytelling sword fight tolkien trilogy visual visually appealing visually stunning war wizards
7162,Cold Mountain (2003),Drama|Romance|War,american civil war based on a book based on book beautiful scenery civil war drama epic great acting historical literary adaptation long love story oscar oscar (best cinematography) oscar (best picture) oscar (best supporting actress) romance war war movie
7209,"M. Hulot’s Holiday (Mr. Hulot's Holiday) (Vacances de Monsieur Hulot, Les) (1953)",Comedy,affectionate criterion enigmatic france holiday hotel humorous light meditative melancholic silent stylized talky visual visually appealing
7234,"Strada, La (1954)",Drama,allegory amazing cinematography black and white bleak criterion enigmatic foreign golden palm imdb top 250 intimate loneliness masterpiece meditative melancholic melancholy oscar (best foreign language film) poignant relationships road movie stylized tragedy
7318,"Passion of the Christ, The (2004)",Drama,biblical bloody brutal brutality christian christianity god intense jesus jews religion sacrifice torture violence violent
7323,"Good bye, Lenin! (2003)",Comedy|Drama,berlin capitalism comedy communism drama east germany foreign german germany idealism mother-son relationship original oscar (best foreign language film) political social commentary
7327,Persona (1966),Drama,allegory art art house artistic black and white breathtaking cerebral cinematography complex criterion downbeat dreamlike enigmatic existentialism golden palm hallucinatory identity intimate loneliness masterpiece meditative melancholic psychological psychology reflective surreal surrealism swedish talky visually appealing weird
7361,Eternal Sunshine of the Spotless Mind (2004),Drama|Romance|Sci-Fi,artistic bittersweet brainwashing cerebral clever complex complicated confusing destiny drama dreams emotional enigmatic excellent script existentialism great acting great ending heartbreaking imagination imdb top 250 intellectual interesting loneliness love love story masterpiece melancholic melancholy memory memory loss mindfuck non-linear nonlinear original philosophical philosophy powerful ending psychological psychology quirky relationships romantic storytelling strange surreal surrealism thought-provoking touching twists & turns very interesting visually appealing visually stunning weird
7365,Noi the Albino (Nói albinói) (2003),Drama,allegory bleak cinematography coming of age criterion depression downbeat enigmatic harsh intimate isolation loneliness meditative melancholic reflective small town solitude
7386,"Ten Commandments, The (1956)",Adventure|Drama,biblical big budget christian classic egypt epic god great movie historical history mythology oscar (best directing) religion slavery special effects story visual
7624,School Ties (1992),Drama,anti-semitism boarding school football high school jews mentor prejudice school teen teen movie
7820,"Virgin Spring, The (Jungfrukällan) (1960)",Crime|Drama,allegory amazing photography black and white bleak brutality catholicism christianity cinematography criterion disturbing enigmatic foreign god golden palm grim guilt harsh imdb top 250 innocence lost intimate masterpiece medieval murder oscar (best foreign language film) rape religion revenge storytelling stylized tense vengeance violence visceral
7937,"Silence, The (Tystnaden) (1963)",Drama,bleak cerebral cinematography claustrophobic criterion disturbing downbeat enigmatic existentialism foreign god golden palm hotel independent film intimate loneliness masterpiece melancholic obsession relationships sexual sisters swedish weird
7938,Winter Light (Nattvardsgästerna) (1963),Drama,affectionate bleak cerebral cinematography criterion depression downbeat enigmatic existentialism god golden palm intimate life & death loneliness love masterpiece meditative melancholic reflective relationships solitude suicide swedish talky
7939,Through a Glass Darkly (Såsom i en spegel) (1961),Drama,bleak cerebral cinematography criterion depression downbeat enigmatic existentialism god independent film insanity intimate isolation loneliness love masterpiece meditative melancholic melancholy mental illness oscar (best foreign language film) poignant reflective relationships schizophrenia swedish talky
7940,The Magician (1958),Drama,artist bleak cinematography criterion enigmatic golden palm masterpiece ominous oscar (best foreign language film) tense
8010,"Power of One, The (1992)",Drama,adapted from:book africa based on a book based on book book books mentor segregation south africa
8014,"Spring, Summer, Fall, Winter... and Spring (Bom yeoreum gaeul gyeoul geurigo bom) (2003)",Drama,adolescence amazing cinematography beautifully filmed bittersweet breathtaking childhood cinematography coming of age compassionate culture clash enigmatic foreign imdb top 250 isolation life life & death loneliness masterpiece meditative melancholic mentor poignant reflective scenic storytelling stunning visual visually stunning
8154,"Dolce Vita, La (1960)",Drama,criterion cynical enigmatic existentialism golden palm imdb top 250 innocence lost intellectual loneliness masterpiece melancholy reflective rome satirical social commentary visually appealing writer's life
8327,Dolls (2002),Drama|Romance,amazing photography beautiful cinematography intimate japan love masterpiece meditative melancholic melancholy original relationships slow paced storytelling surreal tokyo visual visually appealing visually stunning weird
8360,Shrek 2 (2004),Adventure|Animation|Children|Comedy|Musical|Romance,animated animation cartoon clever comedy computer animation crude humor disney fairy tale fairy tales family franchise funny good good sequel hilarious original oscar (best animated feature) parody sequel sequels suprisingly clever talking animals very funny
8368,Harry Potter and the Prisoner of Azkaban (2004),Adventure|Fantasy|IMAX,adapted from:book adventure based on a book based on book big budget boarding school book book was better books coming of age dark dark fantasy emma watson family fantasy fantasy world franchise good versus evil harry potter imagination magic mythology parallel universe series visually stunning witch witches wizards
8405,Hour of the Wolf (Vargtimmen) (1968),Drama|Horror,allegory artist artistic atmospheric bleak cerebral creepy criterion demons disturbing dreamlike eerie enigmatic existentialism hallucinatory innocence lost insanity intimate lynch melancholic psychological reflective stylized surreal surrealism swedish visceral weird
